cod_centro,nombre_centro,lat,lon,municipio,cod_mun,provincia,ccaa,tipo_servicio,concierto,camas,tipo
081430,Hospital Comarcal de L'alt Penedes.,4135636822951027,17049289709141052,Vilafranca Del Penedès,08305,Barcelona,Cataluña,Hospitales Generales,Red de utilización pública (RUP),144,hospitales
081795,Centre Sociosanitari Ricard Fortuny,4133962092151602,17044593416219948,Vilafranca Del Penedès,08305,Barcelona,Cataluña,Hospitales De Media Y Larga Estancia,Red de utilización pública (RUP),187,hospitales
070399,Hospital Universitari Son Espases,3960751834307838,2645910438368975,Palma,07040,Baleares,Baleares,Hospitales Generales,Sin concierto,839,hospitales
070162,Hospital Joan March,3967899097021279,2689038114682408,Bunyola,07010,Baleares,Baleares,Hospitales De Media Y Larga Estancia,Sin concierto,106,hospitales
070333,Hospital Son Llatzer,3957377394991209,2703333974947095,Palma,07040,Baleares,Baleares,Hospitales Generales,Sin concierto,423,hospitales
070388,Hospital Mateu Orfila,3988108645068657,4252053310429101,Maó-Mahón,07032,Baleares,Baleares,Hospitales Generales,Sin concierto,142,hospitales
070184,Hospital Can Misses,3891597590593432,141885294239624,Eivissa,07026,Baleares,Baleares,Hospitales Generales,Sin concierto,382,hospitales
070366,Hospital de Formentera,3870758161992566,14350809221434542,Formentera,07024,Baleares,Baleares,Hospitales Generales,Sin concierto,12,hospitales
070377,Hospital Comarcal D´Inca,397157156991751,29213884487045988,Inca,07027,Baleares,Baleares,Hospitales Generales,Sin concierto,170,hospitales
070309,Hospital  de Manacor,39578607196980120,3207456693314735,Manacor,07033,Baleares,Baleares,Hospitales Generales,Sin concierto,224,hospitales
070048,Hospital General de Mallorca,39574176513448760,26467170520526160,Palma,07040,Baleares,Baleares,Hospitales De Media Y Larga Estancia,Sin concierto,87,hospitales
070051,Hospital Psiquiatric,39583035791489936,26431339645260112,Palma,07040,Baleares,Baleares,Hospitales De Salud Mental Y Tratamiento De Toxicomanías,Sin concierto,168,hospitales
060219,Hospital General de Llerena,3824277396725941,-6013338573364877,Llerena,06074,Badajoz,Extremadura,Hospitales Generales,DC,138,hospitales
060135,Centro Sociosanitario de Merida,38923160108863410,-630932210118704,Mérida,06083,Badajoz,Extremadura,Hospitales De Media Y Larga Estancia,Sin concierto,296,hospitales
060188,Hospital de Zafra,38431083362278320,-642183832731037,Zafra,06158,Badajoz,Extremadura,Hospitales Generales,DC,91,hospitales
060037,Hospital Materno-Infantil,3886590030560954,-69714182033902650,Badajoz,06015,Badajoz,Extremadura,Hospitales Especializados,DC,225,hospitales
060220,Hospital Perpetuo Socorro,38866897879958720,-69714864446682250,Badajoz,06015,Badajoz,Extremadura,Hospitales Generales,DC,282,hospitales
060016,Hospital Universitario de Badajoz,3888381063984702,-7000844818724165,Badajoz,06015,Badajoz,Extremadura,Hospitales Generales,DC,529,hospitales
060242,Hospital Tierra de Barros,38655823675517176,-6377168968575332,Almendralejo,06011,Badajoz,Extremadura,Hospitales Generales,DC,50,hospitales
060253,Hospital Don Benito-Villanueva de La Serena,3896286550304782,-5827330928840106,Don Benito,06044,Badajoz,Extremadura,Hospitales Generales,DC,292,hospitales
060264,Hospital de Merida,3891248971366914,-6363635308525922,Mérida,06083,Badajoz,Extremadura,Hospitales Generales,DC,331,hospitales
060231,Hospital Siberia-Serena,3903139103811861,-5223429055331142,Talarrubias,06127,Badajoz,Extremadura,Hospitales Generales,DC,43,hospitales
050061,Hospital Provincial de Avila (Complejo Asistencial de Avila),4065020094718546,-4692490196669091,Ávila,05019,Ávila,Castilla y León,Hospitales Generales,DC,119,hospitales
050013,Hospital Nuestra Señora de Sonsoles (Complejo Asistencial de Avila),4066589561646655,-4666698927754395,Ávila,05019,Ávila,Castilla y León,Hospitales Generales,DC,321,hospitales
330156,Hospital Universitario de Cabueñes,4352515363280566,-5607080417388247,Gijón,33024,Asturias,Asturias,Hospitales Generales,Sin concierto,457,hospitales
330241,Hospital Valle Del Nalon,4332799888976122,-5721335764895641,Langreo,33031,Asturias,Asturias,Hospitales Generales,Sin concierto,223,hospitales
330292,Hospital Universitario Central de Asturias,43375361754318880,-5827229371053014,Oviedo,33044,Asturias,Asturias,Hospitales Generales,Sin concierto,991,hospitales
330100,Hospital Universitario San Agustin,4355190015216229,-593610776610475,Avilés,33004,Asturias,Asturias,Hospitales Generales,Sin concierto,436,hospitales
330138,Hospital Carmen Y Severo Ochoa,4316580660776115,-6541676622455971,Cangas Del Narcea,33011,Asturias,Asturias,Hospitales Generales,Sin concierto,103,hospitales
330143,Hospital de Jarrio,4354453670912467,-67470108924466490,Coaña,33018,Asturias,Asturias,Hospitales Generales,Sin concierto,116,hospitales
330325,Hospital Vital Alvarez Buylla,4322634693500088,-5781404565077129,Mieres,33037,Asturias,Asturias,Hospitales Generales,Sin concierto,176,hospitales
330045,Hospital Monte Naranco,4336994065431126,-587284699590848,Oviedo,33044,Asturias,Asturias,Hospitales De Media Y Larga Estancia,Sin concierto,194,hospitales
330306,Hospital Del Oriente de Asturias Francisco Grande Covian,43381426653702656,-5184629018169727,Parres,33045,Asturias,Asturias,Hospitales Generales,Sin concierto,90,hospitales
010035,Red de Salud Mental de Araba (Hospital Psiquiatrico de Araba),428359159856807,-26786648398303156,Vitoria-Gasteiz,01059,Araba,País Vasco,Hospitales De Salud Mental Y Tratamiento De Toxicomanías,Sin concierto,175,hospitales
010090,Hospital Universitario Araba (Sede Txagorritxu Y Sede Santiago),4285485306382774,-26902253312152040,Vitoria-Gasteiz,01059,Araba,País Vasco,Hospitales Generales,Sin concierto,806,hospitales
010088,Hospital de Leza,4257599403171243,-26385307015523388,Laguardia,01031,Araba,País Vasco,Hospitales De Media Y Larga Estancia,Sin concierto,63,hospitales
040084,Hospital La Inmaculada,37401492760303330,-19417208587517304,Huércal-Overa,04053,Almería,Andalucía,Hospitales Generales,Sin concierto,184,hospitales
040127,Hospital de Alta Resolucion Eltoyo,3685077173433946,-2312533009345305,Almería,04013,Almería,Andalucía,Hospitales Generales,Sin concierto,44,hospitales
040138,Hospital Materno Infantil,36862141592969840,-24409642196173e3,Almería,04013,Almería,Andalucía,Hospitales Generales,DC,204,hospitales
040097,Hospital Universitario Torrecardenas,3686270459042128,-2441183181527891,Almería,04013,Almería,Andalucía,Hospitales Generales,DC,575,hospitales
040118,Hospital de Poniente,3675329464815091,-2803825474879591,"Ejido, El",04902,Almería,Andalucía,Hospitales Generales,Sin concierto,261,hospitales
030395,Centro Dr. Esquerdo,3839273007873701,-4387897715910045,Sant Joan D'alacant,03119,Alicante,Comunidad Valenciana,Hospitales De Salud Mental Y Tratamiento De Toxicomanías,NA,56,hospitales
030015,Hospital General Universitario Dr. Balmis,3836341479162642,-48606290952976530,Alicante/Alacant,03014,Alicante,Comunidad Valenciana,Hospitales Generales,Sin concierto,807,hospitales
030187,Hospital Sant Vicent Del Raspeig,384033406497287,-5308329742302617,San Vicente Del Raspeig/Sant Vicent Del Raspeig,03122,Alicante,Comunidad Valenciana,Hospitales De Media Y Larga Estancia,Sin concierto,179,hospitales
030373,Hospital Universitario Vinalopo,38255333593100080,-716052503168188,Elche/Elx,03065,Alicante,Comunidad Valenciana,Hospitales Generales,Sin concierto,214,hospitales
030165,Hospital General Universitario de Elda-Virgen de La Salud,3849344442309209,-8058705591024141,Elda,03066,Alicante,Comunidad Valenciana,Hospitales Generales,Sin concierto,513,hospitales
030211,Hospital Vega Baja de Orihuela,38089578062190136,-8535115451903167,Orihuela,03099,Alicante,Comunidad Valenciana,Hospitales Generales,Sin concierto,336,hospitales
030351,Hospital La Pedrera,3882838454997836,9622655177774518,Dénia,03063,Alicante,Comunidad Valenciana,Hospitales De Media Y Larga Estancia,Sin concierto,107,hospitales
030067,Hospital Virgen de Los Lirios,3870559458396372,-4651823182351086,Alcoy/Alcoi,03009,Alicante,Comunidad Valenciana,Hospitales Generales,Sin concierto,305,hospitales
030232,Hospital Psiquiatrico Penitenciario de Fontcalent,3835240443139359,-5632251765745836,Alicante/Alacant,03014,Alicante,Comunidad Valenciana,Hospitales De Salud Mental Y Tratamiento De Toxicomanías,Sin concierto,432,hospitales
030340,Hospital de Denia,3883409542869372,592443581097699,Dénia,03063,Alicante,Comunidad Valenciana,Hospitales Generales,Sin concierto,266,hospitales
030152,Hospital General Universitario de Elche,3826005231846689,-6849141336210436,Elche/Elx,03065,Alicante,Comunidad Valenciana,Hospitales Generales,Sin concierto,408,hospitales
030250,Hospital Universitario San Juan de Alicante,3838914369612365,-435397692426406,Sant Joan D'alacant,03119,Alicante,Comunidad Valenciana,Hospitales Generales,Sin concierto,396,hospitales
030339,Hospital Universitario de Torrevieja,3796350431065655,-7157506475595699,Torrevieja,03133,Alicante,Comunidad Valenciana,Hospitales Generales,Sin concierto,269,hospitales
030204,Hospital Marina Baixa de La Vila Joiosa,3853011180121682,-19837532655863056,"Villajoyosa/Vila Joiosa, La",03139,Alicante,Comunidad Valenciana,Hospitales Generales,Sin concierto,270,hospitales
020096,Hospital de Hellin,3850431282781953,-16887020847025198,Hellín,02037,Albacete,Castilla-La Mancha,Hospitales Generales,Sin concierto,135,hospitales
020019,Hospital General Universitario de Albacete,3898540887835038,-18463029804138508,Albacete,02003,Albacete,Castilla-La Mancha,Hospitales Generales,DC,507,hospitales
020158,Centro de Atencion A La Salud Mental La Milagrosa,39010631115392610,-1868001941671904,Albacete,02003,Albacete,Castilla-La Mancha,Hospitales De Salud Mental Y Tratamiento De Toxicomanías,DC,31,hospitales
020117,Hospital Universitario Nuestra Señora  Del Perpetuo Socorro,3898974314459513,-18716701171534444,Albacete,02003,Albacete,Castilla-La Mancha,Hospitales Generales,DC,165,hospitales
020136,Hospital General de Almansa,3887942432079475,-10942172994536604,Almansa,02009,Albacete,Castilla-La Mancha,Hospitales Generales,Sin concierto,93,hospitales
020147,Hospital General de Villarrobledo,3928013010079962,-26021046859662864,Villarrobledo,02081,Albacete,Castilla-La Mancha,Hospitales Generales,Sin concierto,114,hospitales
150130,Complexo Hospitalario Universitario de Ferrol,43510605656399510,-8216099344394626,Ferrol,15036,A Coruña,Galicia,Hospitales Generales,Sin concierto,467,hospitales
150341,Hospital Publico Virxe Da Xunqueira,42953670018228736,-9191234022501442,Cee,15023,A Coruña,Galicia,Hospitales Generales,Sin concierto,79,hospitales
150011,Complexo Hospitalario Universitario A Coruña,43343877681498256,-8388053061369446,"Coruña, A",15030,A Coruña,Galicia,Hospitales Generales,Sin concierto,1345,hospitales
150336,Hospital Publico Da Barbanza,42593817107552600,-8999401087303239,Ribeira,15073,A Coruña,Galicia,Hospitales Generales,Sin concierto,82,hospitales
150200,Complexo Hospitalario Universitario de Santiago,42869387364012530,-8565744062856446,Santiago De Compostela,15078,A Coruña,Galicia,Hospitales Generales,Sin concierto,1511,hospitales
